{
  "protocolVersion": {"major": 1, "minor": 0},
  "installationId": "11111111-2222-4333-8444-555555555555",
  "bootId": "22222222-3333-4444-8555-666666666666",
  "sessionId": "demo-user-session",
  "observedAt": "2026-10-14T18:00:00Z",
  "platform": "linux",
  "agentVersion": "0.0.0-design-example",
  "environments": [{"id": "demo-linux", "label": "Synthetic Linux environment", "persistence": "tmux"}],
  "desktop": {"state": "unknown", "backend": "sunshine", "version": null},
  "usb": {"state": "unavailable", "backend": null, "version": null},
  "notifications": {"state": "unknown", "text": false, "icons": false, "dismissal": false, "actions": false},
  "events": true
}
